<?xml version="1.0" encoding="UTF-8"?>
<xsd:schema xmlns:xsd="http://www.w3.org/2001/XMLSchema"
            xmlns="http://www.hr.com/jobs"
            targetNamespace="http://www.hr.com/jobs"
            elementFormDefault="qualified" >
  <xsd:element name="jobs">
    <xsd:complexType>
      <xsd:sequence>
        <xsd:element name="job" maxOccurs="unbounded">
          <xsd:annotation>
            <xsd:documentation>A sample element
            </xsd:documentation>
          </xsd:annotation>
          <xsd:complexType>
            <xsd:sequence>
              <xsd:element name="job_id">
                <xsd:simpleType>
                  <xsd:restriction base="xsd:string">
                    <xsd:enumeration value="AC_MGR"/>
                    <xsd:enumeration value="AD_PRES"/>
                    <xsd:enumeration value="FI_MGR"/>
                  </xsd:restriction>
                </xsd:simpleType>
              </xsd:element>
              <xsd:element name="job_title" type="xsd:string"/>
              <xsd:element name="min_salary" type="xsd:string"/>
              <xsd:element name="max_salary" type="xsd:string"/>
            </xsd:sequence>
          </xsd:complexType>
        </xsd:element>
      </xsd:sequence>
    </xsd:complexType>
  </xsd:element>

</xsd:schema>

